{
  "$schema": "http://json-schema.org/draft-07/schema#",
  "type": "object",
  "properties": {
    "_Account": {
      "type": ["null", "string"]
    },
    "_Account_id": {
      "type": ["null", "integer"]
    },
    "StartPeriod": {
      "type": ["null", "string"],
      "format": "date-time"
    },
    "EndPeriod": {
      "type": ["null", "string"],
      "format": "date-time"
    },
    "Currency": {
      "type": ["null", "string"]
    },
    "ParentAccountName": {
      "type": ["null", "string"]
    },
    "ParentAccountId": {
      "type": ["null", "integer"]
    },
    "GrandParentAccountName": {
      "type": ["null", "string"]
    },
    "GrandParentAccountId": {
      "type": ["null", "integer"]
    },
    "CategoryAccountName": {
      "type": ["null", "string"]
    },
    "CategoryAccountId": {
      "type": ["null", "integer"]
    },
    "Classification": {
      "type": ["null", "string"]
    },
    "FullyQualifiedName": {
      "type": ["null", "string"]
    },
    "AccountType": {
      "type": ["null", "string"]
    },
    "FullAccountName": {
      "type": ["null", "string"]
    },
    "Class": {
      "type": ["null", "string"]
    },
    "Total_Money": {
      "type": ["null", "number"]
    },
    "_airbyte_emitted_at": {
      "type": ["null", "string"],
      "format": "date-time"
    }
  }
}
